{
  "schema_name": "segment_preview",
  "schema_version": "1.0.0",
  "artifact_id": "art_segment_preview_example",
  "project_id": "prj_demo",
  "revision_id": "rev_001",
  "created_at": "2026-07-24T12:00:00Z",
  "producer": {
    "application_version": "0.2.0",
    "stage": "segment-preview",
    "adapter": "ffmpeg",
    "adapter_version": "fixture"
  },
  "inputs": [
    {"artifact_id": "segment_preview_media", "sha256": "1111111111111111111111111111111111111111111111111111111111111111"},
    {"artifact_id": "segment_preview_transcript", "sha256": "2222222222222222222222222222222222222222222222222222222222222222"}
  ],
  "config_sha256": "0000000000000000000000000000000000000000000000000000000000000000",
  "planning_key": "aaaaaaaaaaaaaaaaaaaaaaaaaaaaaaaaaaaaaaaaaaaaaaaaaaaaaaaaaaaaaaaa",
  "source_media": {
    "path": "C:/projects/prj_demo/work/render.mp4",
    "sha256": "1111111111111111111111111111111111111111111111111111111111111111"
  },
  "transcript": {
    "artifact_id": "segment_preview_transcript",
    "path": "C:/projects/prj_demo/artifacts/transcript.json",
    "sha256": "2222222222222222222222222222222222222222222222222222222222222222"
  },
  "duration_us": 6000000,
  "frame_rate": {"numerator": 30, "denominator": 1},
  "policy": {
    "max_segment_duration_us": 10000000,
    "context_before_us": 1000000,
    "context_after_us": 1000000,
    "gap_merge_us": 1000000,
    "derived_from": "transcript"
  },
  "segments": [
    {
      "segment_id": "segment_000001",
      "ordinal": 1,
      "label": "before",
      "transcript_segment_ids": ["seg_000001"],
      "source_range": {"start_us": 0, "end_us": 2200000},
      "preview_path": "C:/projects/prj_demo/review/segments/segment_000001/aaaaaaaaaaaaaaaa/preview.mp4",
      "preview_sha256": "3333333333333333333333333333333333333333333333333333333333333333",
      "expected_duration_us": 2200000,
      "actual_duration_us": 2200000,
      "frame_count": 66,
      "diagnostics": {
        "decode": "pass",
        "video_stream": "pass",
        "audio_stream": "pass",
        "duration": "pass"
      },
      "status": "rendered"
    }
  ],
  "warnings": [],
  "status": "complete"
}
